{
  "node_id": "concept:mass-fraction",
  "title": "溶质质量分数",
  "pattern_refs": ["pattern:concept-core"],
  "summary": "溶质质量分数是溶质质量与溶液质量之比，用于定量表示溶液的组成。",
  "sections": [
    {
      "id": "definition",
      "title": "定义",
      "content": [
        "溶质质量分数是溶质质量与溶液质量之比，常用百分数表示。",
        "计算公式：溶质质量分数 = 溶质质量/溶液质量 × 100%"
      ],
      "source_refs": ["evidence:chem-grade9-all-in-one:lesson-1-1-3:01"]
    },
    {
      "id": "essence",
      "title": "本质理解",
      "content": [
        "溶质质量分数是定量表示溶液浓度的方法之一。",
        "溶质质量分数越大，溶液越浓。"
      ],
      "source_refs": ["evidence:chem-grade9-all-in-one:lesson-1-1-3:01"]
    },
    {
      "id": "key-points",
      "title": "核心要点",
      "content": [
        "溶质质量分数是一个比值，没有单位。",
        "溶液质量 = 溶质质量 + 溶剂质量。",
        "溶质质量分数可用于配制一定浓度的溶液。"
      ],
      "source_refs": ["evidence:chem-grade9-all-in-one:lesson-1-1-3:01"]
    }
  ],
  "source_refs": ["evidence:chem-grade9-all-in-one:lesson-1-1-3:01"],
  "properties": {},
  "updated_at": "2026-03-24T00:00:00+08:00",
  "status": "draft"
}
