{
  "node_id": "concept:ion",
  "title": "离子",
  "pattern_refs": ["pattern:concept-core"],
  "summary": "带电的原子或原子团，由原子得失电子形成。",
  "sections": [
    {
      "id": "definition",
      "title": "定义",
      "content": [
        "离子是带电的原子或原子团。",
        "由原子得失电子形成。"
      ],
      "source_refs": ["evidence:chem-grade8-all-in-one:lesson3-2-1-core"]
    },
    {
      "id": "essence",
      "title": "本质理解",
      "content": [
        "离子是构成物质的一种粒子。",
        "离子带正电或负电。"
      ],
      "source_refs": ["evidence:chem-grade8-all-in-one:lesson3-2-1-core"]
    },
    {
      "id": "key-points",
      "title": "核心要点",
      "content": [
        "离子是带电的原子或原子团",
        "原子失去电子形成阳离子",
        "原子得到电子形成阴离子"
      ],
      "source_refs": ["evidence:chem-grade8-all-in-one:lesson3-2-1-core"]
    }
  ],
  "source_refs": ["evidence:chem-grade8-all-in-one:lesson3-2-1-core"],
  "mention_refs": ["mention:chem-grade8-all-in-one:lesson3-2-1-2"],
  "properties": {}
}
