{
  "node_id": "substance:calcium-hydroxide",
  "title": "氢氧化钙",
  "pattern_refs": ["pattern:substance-profile"],
  "summary": "氢氧化钙俗称熟石灰或消石灰，是一种常见的碱，在水溶液中能离解出Ca2+和OH-。",
  "sections": [
    {
      "id": "identity",
      "title": "基本身份",
      "content": [
        "氢氧化钙俗称熟石灰或消石灰。",
        "氢氧化钙是一种常见的碱。",
        "氢氧化钙在水溶液中能离解出金属离子和OH-。"
      ],
      "source_refs": ["evidence:chem-grade9-all-in-one:lesson-1-2-1:02"]
    },
    {
      "id": "properties",
      "title": "主要性质",
      "content": [
        "氢氧化钙具有碱的通性。",
        "氢氧化钙是白色粉末状固体。",
        "氢氧化钙微溶于水，其水溶液俗称石灰水。",
        "氢氧化钙有腐蚀性。"
      ],
      "source_refs": ["evidence:chem-grade9-all-in-one:lesson-1-2-1:02", "evidence:chem-grade9-all-in-one:lesson-1-2-2:02"]
    },
    {
      "id": "applications",
      "title": "用途与应用",
      "content": [
        "氢氧化钙可用于建筑行业。",
        "氢氧化钙可用于改良酸性土壤。",
        "氢氧化钙可用于配制农药。"
      ],
      "source_refs": ["evidence:chem-grade9-all-in-one:lesson-1-2-1:02"]
    }
  ],
  "source_refs": ["evidence:chem-grade9-all-in-one:lesson-1-2-1:02", "evidence:chem-grade9-all-in-one:lesson-1-2-2:02"],
  "properties": {},
  "updated_at": "2026-03-24T00:00:00+08:00",
  "status": "draft"
}
