{
  "node_id": "concept:base-properties",
  "title": "碱的通性",
  "pattern_refs": ["pattern:concept-core"],
  "summary": "不同的碱在水溶液中都能离解出OH-，因此碱具有相似的化学性质。",
  "sections": [
    {
      "id": "definition",
      "title": "定义",
      "content": [
        "不同的碱在水溶液中都能离解出金属离子和OH-。",
        "碱具有相似的性质，称为碱的通性。"
      ],
      "source_refs": ["evidence:chem-grade9-all-in-one:lesson-1-2-2:02"]
    },
    {
      "id": "essence",
      "title": "本质理解",
      "content": [
        "碱的通性源于碱溶液中都存在OH-。",
        "OH-决定了碱的化学性质。"
      ],
      "source_refs": ["evidence:chem-grade9-all-in-one:lesson-1-2-2:02"]
    },
    {
      "id": "key-points",
      "title": "核心要点",
      "content": [
        "碱能与某些非金属氧化物反应生成盐和水。",
        "碱能与某些盐溶液反应生成新的盐和新的碱。",
        "碱能使酸碱指示剂变色。"
      ],
      "source_refs": ["evidence:chem-grade9-all-in-one:lesson-1-2-2:02"]
    }
  ],
  "source_refs": ["evidence:chem-grade9-all-in-one:lesson-1-2-2:02"],
  "properties": {},
  "updated_at": "2026-03-24T00:00:00+08:00",
  "status": "draft"
}
