{
  "node_id": "concept:composite-material",
  "title": "复合材料",
  "pattern_refs": ["pattern:concept-core"],
  "summary": "复合材料是由两种或两种以上不同性质的材料组合而成的新型材料。",
  "sections": [
    {
      "id": "definition",
      "title": "定义",
      "content": [
        "复合材料是由两种或两种以上不同性质的材料组合而成的新型材料。",
        "复合材料的性能优于各组分材料。"
      ],
      "source_refs": ["evidence:chem-grade9-all-in-one:lesson-2-2-3:03"]
    },
    {
      "id": "essence",
      "title": "本质理解",
      "content": [
        "复合材料结合了各组分材料的优点。",
        "复合材料与高分子材料有密切关系。"
      ],
      "source_refs": ["evidence:chem-grade9-all-in-one:lesson-2-2-3:03"]
    },
    {
      "id": "key-points",
      "title": "核心要点",
      "content": [
        "复合材料由两种或多种材料组合而成。",
        "复合材料具有单一材料所不具备的优良性能。",
        "玻璃钢、碳纤维复合材料是常见的复合材料。"
      ],
      "source_refs": ["evidence:chem-grade9-all-in-one:lesson-2-2-3:03"]
    }
  ],
  "source_refs": ["evidence:chem-grade9-all-in-one:lesson-2-2-3:03"],
  "properties": {},
  "updated_at": "2026-03-24T00:00:00+08:00",
  "status": "draft"
}
