{
  "node_id": "experiment:mass-conservation",
  "title": "验证质量守恒定律实验",
  "pattern_refs": ["pattern:experiment-procedure"],
  "summary": "通过实验验证化学反应前后质量守恒。",
  "sections": [
    {
      "id": "goal",
      "title": "实验目的",
      "content": [
        "验证质量守恒定律",
        "认识化学反应前后质量守恒"
      ],
      "source_refs": ["evidence:chem-grade8-all-in-one:lesson4-1-1-core"]
    },
    {
      "id": "principle",
      "title": "实验原理",
      "content": [
        "参加化学反应的各物质的质量总和等于反应后生成的各物质的质量总和"
      ],
      "source_refs": ["evidence:chem-grade8-all-in-one:lesson4-1-1-core"]
    },
    {
      "id": "procedure",
      "title": "基本步骤",
      "content": [
        "称量反应前各物质的总质量",
        "进行化学反应",
        "称量反应后各物质的总质量",
        "比较反应前后的质量"
      ],
      "source_refs": ["evidence:chem-grade8-all-in-one:lesson4-1-1-core"]
    },
    {
      "id": "observations",
      "title": "现象与结论",
      "content": [
        "现象：反应前后质量相等",
        "结论：化学反应遵循质量守恒定律"
      ],
      "source_refs": ["evidence:chem-grade8-all-in-one:lesson4-1-1-core"]
    }
  ],
  "source_refs": ["evidence:chem-grade8-all-in-one:lesson4-1-1-core"],
  "mention_refs": ["mention:chem-grade8-all-in-one:lesson4-1-1-2"],
  "properties": {}
}
