{
  "node_id": "concept:chemical-change",
  "title": "化学变化",
  "pattern_refs": ["pattern:concept-core"],
  "summary": "生成与原来不同的物质的变化，也称为化学反应。化学反应前的原物质叫反应物，化学反应后产生的新物质叫生成物或产物。",
  "sections": [
    {
      "id": "definition",
      "title": "定义",
      "content": [
        "这种生成与原来不同的物质的变化叫做化学变化，也称为化学反应。",
        "化学反应前的原物质叫反应物，化学反应后产生的新物质叫生成物或产物。",
        "利用化学反应可以实现物质的转化。"
      ],
      "source_refs": ["evidence:chem-grade8-all-in-one:lesson1-1-1-chemical-change"]
    },
    {
      "id": "essence",
      "title": "本质理解",
      "content": [
        "化学变化的核心特征是生成新物质。",
        "化学变化是物质转化的基本方式。"
      ],
      "source_refs": ["evidence:chem-grade8-all-in-one:lesson1-1-1-chemical-change"]
    },
    {
      "id": "key-points",
      "title": "核心要点",
      "content": [
        "化学变化的本质特征：生成新物质",
        "反应物：化学反应前的原物质",
        "生成物（产物）：化学反应后产生的新物质"
      ],
      "source_refs": ["evidence:chem-grade8-all-in-one:lesson1-1-1-chemical-change"]
    },
    {
      "id": "examples",
      "title": "典型例子",
      "content": [
        "镁带燃烧：镁 + 氧气 → 氧化镁",
        "木炭燃烧：碳 + 氧气 → 二氧化碳",
        "铁丝燃烧：铁 + 氧气 → 四氧化三铁"
      ],
      "source_refs": ["evidence:chem-grade8-all-in-one:lesson1-1-1-chemical-change", "evidence:chem-grade8-all-in-one:lesson1-1-1-phenomena"]
    },
    {
      "id": "non-examples",
      "title": "易混反例",
      "content": [
        "水的沸腾：只是形态变化，没有生成新物质，属于物理变化",
        "镁带剪断：只是形状变化，没有生成新物质，属于物理变化"
      ],
      "source_refs": ["evidence:chem-grade8-all-in-one:lesson1-1-1-physical-change"]
    }
  ],
  "source_refs": ["evidence:chem-grade8-all-in-one:lesson1-1-1-chemical-change", "evidence:chem-grade8-all-in-one:lesson1-1-1-phenomena"],
  "mention_refs": ["mention:chem-grade8-all-in-one:lesson1-1-1-chemical-change"],
  "properties": {}
}
