{
  "node_id": "concept:decomposition-reaction",
  "title": "分解反应",
  "pattern_refs": ["pattern:concept-core"],
  "summary": "一种物质生成两种或两种以上物质的反应。",
  "sections": [
    {
      "id": "definition",
      "title": "定义",
      "content": [
        "一种物质生成两种或两种以上物质的反应叫做分解反应。"
      ],
      "source_refs": ["evidence:chem-grade8-all-in-one:lesson4-1-2-core"]
    },
    {
      "id": "essence",
      "title": "本质理解",
      "content": [
        "分解反应的特点是\"一变多\"。",
        "是化学反应的基本类型之一。"
      ],
      "source_refs": ["evidence:chem-grade8-all-in-one:lesson4-1-2-core"]
    },
    {
      "id": "key-points",
      "title": "核心要点",
      "content": [
        "分解反应的特点：一变多",
        "一种反应物",
        "生成两种或两种以上产物"
      ],
      "source_refs": ["evidence:chem-grade8-all-in-one:lesson4-1-2-core"]
    },
    {
      "id": "examples",
      "title": "典型例子",
      "content": [
        "过氧化氢 → 水 + 氧气",
        "高锰酸钾加热分解",
        "水通电 → 氢气 + 氧气"
      ],
      "source_refs": ["evidence:chem-grade8-all-in-one:lesson4-1-2-core"]
    }
  ],
  "source_refs": ["evidence:chem-grade8-all-in-one:lesson4-1-2-core"],
  "mention_refs": ["mention:chem-grade8-all-in-one:lesson4-1-2-3"],
  "properties": {}
}
